<?xml version="1.0"?>
<hivemq xmlns:xsi="http://www.w3.org/2001/XMLSchema-instance"
        xsi:noNamespaceSchemaLocation="hivemq-config.xsd">

    <listeners>
        <tcp-listener>
            <port>1883</port>
            <bind-address>0.0.0.0</bind-address>
        </tcp-listener>
    </listeners>
    <mqtt>
        <max-client-id-length>65535</max-client-id-length>
        <retry-interval>10</retry-interval>
    </mqtt>
    <throttling>
        <max-connections>-1</max-connections>
        <max-message-size>268435456</max-message-size>
        <outgoing-limit>0</outgoing-limit>
        <incoming-limit>0</incoming-limit>
    </throttling>
    <general>
        <update-check-enabled>true</update-check-enabled>
    </general>
    <persistence>
        <client-session>
            <general>
                <mode>in-memory</mode>
            </general>
            <queued-messages>
                <mode>in-memory</mode>
                <max-queued-messages>1000</max-queued-messages>
            </queued-messages>
            <subscriptions>
                <mode>in-memory</mode>
            </subscriptions>
        </client-session>
        <retained-messages>
            <mode>in-memory</mode>
        </retained-messages>
        <message-flow>
            <incoming>
                <mode>in-memory</mode>
            </incoming>
            <outgoing>
                <mode>in-memory</mode>
            </outgoing>
        </message-flow>
    </persistence>
</hivemq>