<?xml version="1.0"?>
<hivemq xmlns:xsi="http://www.w3.org/2001/XMLSchema-instance"
        xsi:noNamespaceSchemaLocation="hivemq-config.xsd">

    <listeners>
        <!--<tcp-listener>
            <port>1883</port>
            <bind-address>0.0.0.0</bind-address>
        </tcp-listener>  -->
		<tcp-listener>
             <port>1884</port>
             <bind-address>192.168.137.1</bind-address>
         </tcp-listener>
		 
		 <!-- New -->
		 <websocket-listener>
            <port>8000</port>
            <bind-address>192.168.137.1</bind-address>
            <path>/mqtt</path>
            <subprotocols>
                <subprotocol>mqttv3.1</subprotocol>
            </subprotocols>
            <allow-extensions>true</allow-extensions>
        </websocket-listener>
		
    </listeners>
    <mqtt>
        <max-client-id-length>65535</max-client-id-length>
        <retry-interval>10</retry-interval>
        <max-queued-messages>1000</max-queued-messages>
    </mqtt>
    <throttling>
        <max-connections>-1</max-connections>
        <max-message-size>268435456</max-message-size>
        <outgoing-limit>0</outgoing-limit>
        <incoming-limit>0</incoming-limit>
    </throttling>
    <general>
        <update-check-enabled>true</update-check-enabled>
    </general>

</hivemq>